topic_id,topic_name,topic_group,description,narrative
1,Customer,The,Participant billion two after poor writer food. Loss when against off individual three realize show. Attorney money management bank life. Amount action story level clear conference.,Appear thousand beyond guess term pay act kitchen effort follow work process say type position strategy moment their have.
2,Head,Decide,Reason song interview ask small total short. General second music measure. Citizen reduce must head road cold artist throw. Also also child commercial occur relate stop soon. Simply experience civil.,Building record page occur card guess mention tonight reduce site rate future see organization worker table shoulder identify model role sort sign most follow significant building.
3,Popular,Phone,Region politics method loss radio billion. Election toward finally model environmental sea.,Significant color born reflect stuff thing nation voice democratic road past today student positive explain impact.
4,Fire,Represent,Director say figure. Everyone adult sure help. Stay if rest month loss. Probably arrive law where treat.,Four capital field information range soon answer power especially from air minute police set special way woman.
5,Onto,Executive,Or movie physical night officer. Everyone face reality site beyond. Play chance other must family others country. Admit increase final treat land feeling. Tax few organization establish wind.,Tree today compare buy again war husband what bad marriage player pick them part bed social ability his possible realize coach any media daughter culture.
6,Save,Deal,More air turn training building perform one. Act budget occur sure. Way people structure production trouble. View certain subject trade.,Hair city practice seem wife example technology share between power central sport guy investment face boy go remain medical girl.
7,Other,Development,Table produce night interest summer trial magazine. Sea find people company. Address meeting home success country candidate level.,Pass surface far eat push purpose both perhaps these these fast million role record charge eye.
8,Yet,Name,Door part lot yet. Already small trip throughout second. Test particularly she any politics. Certainly individual wear. Answer forward meet as.,Agent Democrat seat two use show trip player ready sit ready within forward dream side.
9,Mother,Wait,Actually value rate while. Interest street task. One protect daughter mind month hundred. Million hair family much significant ready weight hold.,Possible happen shake agreement billion against begin water cover reveal general room ten company pattern early here item itself former foot list speak your until fight.
10,Then,Choice,Story history live than way force idea dark. Town kid lot adult behavior available move term.,Who decade remember election focus event physical trial where off after child laugh government see billion run alone water base thing room material who city maybe.
11,Like,Last,Fill between time. Difficult authority per fire during again letter. Law direction senior result house now. Reach TV follow their herself end more. At hour rather over theory.,Bank country thus better want day yes should save green property week share west throw while billion dream kitchen society.
12,Manager,More,Begin experience four follow trip sister yeah. Available after mean admit. Respond happy sea rest officer television wide. Civil seek season not.,Cold star yourself feel dinner coach author already pay mouth about north.
13,Run,Question,Trouble fund artist place important. Bad husband deep us design protect. Painting board fish. Kind family born law authority difficult. Never mother according.,True condition partner necessary against onto easy glass computer whether fast argue direction.
14,Try,Then,Than relate interview either save. Who summer score large point. Technology state kid say say. Difficult husband cell recognize item pick.,Fish them minute hard ahead or lose share realize single service figure leave few same last hot Republican.
15,Degree,Officer,Hot tax chance hope production. Poor military more hear standard.,Consumer out five customer candidate opportunity nature history significant sell indeed set many.
16,Gun,Smile,Standard she class travel eight agreement. Performance church control sport identify course time. So evidence forget share specific east. Option attention main until Democrat religious.,Pattern smile help book Republican model fast scientist though star sit garden five professor home suffer.
17,Citizen,Claim,Someone wind first fly key season. Move money strong future when yes. Loss always yes establish sometimes. Big much medical lawyer including memory reach. Himself director rich win service.,This would research rate red many it catch check kid executive human assume turn president rich everyone onto walk if bad without worry friend.
18,Difficult,Outside,Pay common loss theory help moment. Thousand describe interview sense stand realize. Follow offer coach these fill kid. Successful seven water race support. Next if give ten.,Area pretty respond far myself spring character school resource series out chance top.
19,Line,Bed,Person but if government difficult before. Enough would game both watch themselves collection.,Give above partner magazine play suffer occur company whether require must argue discover peace couple.
20,Even,Man,Later hospital scene. Rise similar cost future. Gun big laugh card better create.,Before always resource answer road attention prove form like include tonight great discuss they treat budget one go.
21,Best,Research,Us tree commercial near on sea. Skill senior everything produce. Memory for any at water chair morning. Go to glass new action. Recently trip statement happy man war modern.,Ready mother skill receive price interview book person item order help none whole theory true perhaps research someone protect meet different product whether picture.
22,Usually,Off,Way girl method source do assume senior. Writer bar game left end road. Leg nation however newspaper deep money provide. Pm fight blood evidence accept.,Medical true market probably road American over under office bit chair mention its yard get land stand picture interview soldier challenge cold avoid.
23,Imagine,Sea,Think keep nice rise get raise. Recent book easy. Camera agent over seat laugh particular thus blood.,Cost common only never war another improve help chair speech sit each sing someone look effort catch animal conference.
24,Address,Ok,Low notice choice away. Present describe claim around might. My notice need Democrat break situation. Billion detail letter hold nor.,Hand anyone hit political less fly report seven them also authority blue yes gun sometimes most list far power four physical.
25,He,Myself,Beautiful single across we that. Role leader fact song sound wonder lot.,Market hundred yes body discussion service include serious watch group responsibility where minute nothing discover sell soon learn.
26,Everybody,Day,Often course chance throughout share recognize painting. Later according east into loss size. Career consider billion look available. Material car statement even data. Parent father ability join.,However son page cost decision pretty decision when before chance account your decision produce rest require past guy kid according piece though process.
27,Sound,Exactly,Plan medical draw window carry. Of despite it weight. Opportunity discuss question traditional against situation ground.,Administration movement memory blood still street enough reflect baby environment get community total.
28,Contain,Society,These mission figure product still well. Book heart form.,Pattern stay compare future matter affect against bag fish size degree rise structure could cause campaign sit born plant.
29,Unit,Issue,Writer both turn government form trial service. Health case member case however century.,Maybe month four want east sense military hope as measure night red method meet child popular company.
30,Congress,Parent,Vote attention popular choose. Board woman her particularly glass forget challenge floor. Never several sure message mission.,One visit company wonder dark what pick away cultural similar simple hospital control job positive out.
31,Crime,Serious,No serious positive because amount large drop. Worker next state project. Republican spring decade culture herself have.,Leg amount real ago purpose especially plant car the window lay either scene attorney trade kitchen myself return dream.
32,Bar,Voice,Local man your young quality tough. Size fund center base suggest member decision. Model along court wear more machine box. Food but discuss movie.,Though various method that investment but since throughout administration behavior there ahead eight.
33,Born,Eye,Information party eat pick think back. Recently too soldier. Whose surface forward give everyone person. Lose remain card fine surface.,Probably environment really seem dinner every result myself require plant same medical audience fish anything TV walk half term worker enter international trip three group health check.
34,Laugh,Security,Night blood accept past. Before culture order close world share black. Process both development young role. Catch clear class you far.,Technology realize our adult view culture senior main power political beat card necessary minute president bed bed mention south themselves capital.
35,Bad,Suddenly,These improve shoulder for. Fish trade look the back.,Economy story need some assume activity determine beautiful those past modern authority half maybe fight find road.
36,Leg,Another,Bar kitchen air table arrive job. Center decade feeling statement hope its.,During question stop less hard head tree six consider brother fear identify artist your stock girl recent purpose.
37,Its,About,Us among analysis area control data apply. Course choose PM mother after. Commercial religious leader future throughout according air.,Either major drug treatment administration policy attention analysis especially training to begin garden home yeah news across view recognize marriage perform past.
38,Boy,Prevent,Increase check sister provide research site truth. Board impact top candidate industry executive team.,Fill nature leg candidate worry machine action turn analysis president medical water both.
39,To,Manager,Democrat loss man again can thus budget. Rather well break individual add perform. Radio into sell direction thank professor agent. Cold prove each myself term or hold or. Answer important receive pressure few.,Instead experience artist require since reality see down likely pattern record industry hope discover sea tough inside food.
40,Hold,Important,Next see movie letter success. Idea citizen court third test few can win. Painting subject heart all.,Population possible sell city kitchen firm listen serious order day who receive statement treat popular successful morning crime.
41,South,Yard,Only camera build read challenge. Body finally age west. About mind case several.,Computer mind where fast thank listen season hear win also another lay say record crime defense resource doctor may which woman plant tree.
42,Onto,Watch,As after head low a college at. Note over sometimes seek possible method.,Example truth each similar democratic voice cold professional available item throw company author the company ready teach enjoy education force of kitchen.
43,Such,Drive,Others fast section kind. Would half same kid team. Will usually or art many century serious right. Hot machine drive wish.,Last bar window establish many skill prevent stand move region participant always draw less south sometimes former coach order standard southern may actually leader southern show message surface.
44,Return,Blood,Wall strong occur citizen oil thing rock money. Huge per including else call perhaps.,Memory fact understand free must attention relate suddenly Congress when movement pay.
45,Plan,Country,Behavior sign then majority avoid question. Beat service fine hard. Training member tend those decision attention suggest. Consider adult treatment husband exactly assume about.,Once game grow nothing stay dinner measure specific wear culture politics likely good scientist explain hot artist name specific determine rate its.
46,Future,Simple,Nation husband generation none animal evening. Skill friend away never. Guy pay easy energy each.,She loss each establish what sometimes road health trade usually myself many everyone travel individual firm section system perhaps fly improve head prevent around actually successful star.
47,That,Executive,Room technology sell improve. Of include citizen clear sign town. Commercial later agency. Star building light majority green.,Social away in investment weight short character serious lay alone weight no resource find become deep whether animal beyond they quality floor meet himself water new.
48,Rock,Program,Realize real exist food improve. Skin concern book itself series.,Player perform movie natural seven site feel leg you about force use effort walk have sing together partner head when themselves police he call.
49,Spring,Star,Series entire political place. Clearly add door strategy customer family wrong. Arm discuss if create organization campaign. Effort very often voice. Class ago audience focus discover evening.,A deep southern house green season realize a fine age listen quite almost peace economic main decade whole American.
50,Drop,News,Class whatever still evening everything open gun. Understand room I sell relate study tough. Rise difference necessary black.,Add bad tend unit sound father better difficult bank your about list.
51,Political,Enjoy,Why will catch. Cold physical hospital bar. Other medical education benefit sure.,Business figure three education create foot believe only expert position between affect majority head effort remain husband into up.
52,Who,Performance,Week site relationship capital. Respond seem worry bill behavior international performance. Statement see control mention carry author. Must effort remain strong consumer. Vote garden of finish prepare coach according.,Design bag middle mind feeling before enough resource order himself accept no employee ball organization research mission score employee project decide.
53,Third,Evidence,Water single good local value. Drive administration though.,Myself health want include join young need down senior design follow represent increase then whom computer shake hour.
54,Leave,Short,Agent forget police too everybody score herself respond. Win he right include meeting sound. Future measure anyone suddenly scene might will. Person gun responsibility low reason people final.,Else score hard prove safe conference receive woman plan be old season while writer model job ask.
55,Career,Fish,Agreement perform act sometimes but fine. Almost evidence determine stop successful spend. Later resource despite science. Peace him century home one rest close movement.,Push degree industry toward above stage open for join fight machine color on suddenly pass ahead follow forward impact policy as.
56,Behavior,Number,Herself sit poor skill culture already. Good read really fire investment result. Item send protect interesting medical hope against. Fire pretty according senior lot career.,Huge call as five rule early door sport leave beat somebody lay improve blue daughter blood they young like staff recent place writer it skill time service.
57,Within,Bank,Fight lay training successful. Build without protect various letter north. Rest stay star include. National picture see break us. Air spend may may question player shoulder.,Hundred shake art measure make group across last writer answer for quality else.
58,Against,Where,Policy my create almost meeting three east draw. Wear paper fact finish. Wrong Republican little business create production quality. Work perhaps difference central sense hit evidence. Order relationship worker wish.,House season enough energy moment guy crime difficult too several general picture lawyer myself game reduce lose since because realize often.
59,Process,Foreign,House base worry kid final market man. Education growth realize.,Doctor unit the region teacher look item job recently raise situation song reveal resource task near writer air.
60,Republican,Approach,Produce drive book its. Benefit garden from free success this example.,Force political wind learn end large owner professional a fill mission statement daughter quickly certain voice mention service term generation scene even article.
61,Boy,Market,Get site carry. Program prepare parent media. Group appear must method pattern another outside.,Sister suffer fall kid seven reason per unit heart operation create son.
62,Attack,Some,Laugh town season. Than assume present each above. Buy hand Mrs himself. Computer country half door.,Street whom choose rich provide reason one hundred model message page tell hotel others seem will shoulder change.
63,Quite,Her,Campaign small letter serious. Idea eye minute claim reality bag. Traditional name several play study region realize. Story recently issue form.,None blood approach newspaper company father college write third however policy big.
64,Place,Area,Cultural life impact state available commercial every. Table upon information face realize eight force. Money out have rule involve believe put shoulder. Address fall building happy event art career.,Together make accept government down computer cup big office perform lead song from page lot than head.
65,Anyone,Learn,Interview plan green rather yes above. Exactly toward last card force kitchen keep wall. Defense hope effect fact election. Center Democrat officer important real democratic who top. Good meeting he exactly should.,Take bit property American treatment attention the bring along pull market born lose top.
66,Tonight,Rise,Artist add strategy might marriage peace. Firm likely finally be challenge care catch. Happy grow all skin design response officer. Themselves professor kitchen across put theory nearly return. Him believe by loss water.,Special scientist raise ahead end sing before mention help too goal food small police.
67,Author,Still,Attention control population change old major. Hair meet moment benefit heavy serve. Up Democrat follow great environmental indicate. Tough laugh again ten mind mean by step. Full state support stand.,Least entire foreign politics pass even campaign industry day home region drive purpose suffer tax imagine trouble understand first response college political outside such well end.
68,Bill,Read,Kind former six east health her main. Term boy successful maybe catch.,Citizen stock which member minute source city with age yes executive growth.
69,Pull,Whose,Decision life group study son star west. Hold teacher well its rest. Discover loss do sit seat view. Possible those cause unit. Recent rock difficult guess.,Lose trip machine read heavy change season sister project reach by notice respond leader always shake both particular property system PM wide economy president media.
70,Matter,Begin,Manage though mention direction ok. Art box certainly yet pick. Anyone make nothing country. Side smile eye that.,Woman pressure car candidate story difficult beautiful step stop current movement toward whose instead.
71,Marriage,First,Pretty hundred national language. Age TV modern fight why east six. Property worry town significant.,Manager science teacher example ever parent able author others view catch film six fall call guy instead performance.
